{
  "$schema": "https://json-schema.org/draft/2020-12/schema",
  "description": "Schéma FIGÉ de la source `invoices`, inféré depuis 19 enregistrement(s) puis RELU (identifiants dé-énumérés, listes closes complétées, champs nullables typés, descriptions métier). C'est lui qui fait foi, pas les données : un champ absent d'ici est omis de la sortie de l'outil, et un écart de type au démarrage est [DATA_SOURCE_SCHEMA_DRIFT].",
  "properties": {
    "amount_excl_tax": {
      "description": "Montant HT, EUR, chaîne à deux décimales.",
      "type": "string"
    },
    "amount_incl_tax": {
      "description": "Montant TTC, EUR, chaîne à deux décimales — le montant à citer par défaut.",
      "type": "string"
    },
    "currency": {
      "description": "Devise — toujours EUR.",
      "enum": [
        "EUR"
      ],
      "type": "string"
    },
    "customer_id": {
      "description": "Identifiant du client facturé (CUST-NNNN). Filtre d'identité ; non énumérable.",
      "type": "string"
    },
    "due_at": {
      "description": "Date d'échéance de règlement (date seule). Pertinente surtout pour un virement en attente.",
      "format": "date",
      "type": "string"
    },
    "invoice_id": {
      "description": "Numéro de facture (INV-AAAA-NNNN), à citer dans toute réponse de facturation.",
      "type": "string"
    },
    "issued_at": {
      "description": "Date d'émission, UTC ISO 8601.",
      "format": "date-time",
      "type": "string"
    },
    "order_id": {
      "description": "Numéro de la commande facturée.",
      "type": "string"
    },
    "pdf_available": {
      "description": "true si le PDF de la facture est téléchargeable depuis l'espace client.",
      "type": "boolean"
    },
    "status": {
      "description": "issued (émise, non réglée), paid, partially_refunded, refunded, cancelled.",
      "enum": [
        "issued",
        "paid",
        "partially_refunded",
        "refunded",
        "cancelled"
      ],
      "type": "string"
    },
    "tax_amount": {
      "description": "Montant de TVA, EUR, chaîne à deux décimales.",
      "type": "string"
    },
    "tax_rate": {
      "description": "Taux de TVA en fraction (0.20 = 20 %).",
      "enum": [
        "0.20"
      ],
      "type": "string"
    }
  },
  "required": [
    "amount_excl_tax",
    "amount_incl_tax",
    "currency",
    "customer_id",
    "due_at",
    "invoice_id",
    "issued_at",
    "order_id",
    "pdf_available",
    "status",
    "tax_amount",
    "tax_rate"
  ],
  "title": "invoices",
  "type": "object",
  "x-sdda": {
    "generator": "gen_source_tools.py --infer",
    "recordsObserved": 19,
    "reviewed": true,
    "sourceId": "invoices",
    "reviewedBy": "Tech Lead — workspace/assets/_generate.py est la SSoT des valeurs"
  }
}
