[
  {
    "invoice_id": "INV-2026-0001",
    "order_id": "300",
    "customer_id": "CUST-0001",
    "issued_at": "2026-09-12T09:00:00Z",
    "due_at": "2026-09-12",
    "currency": "EUR",
    "amount_excl_tax": "124.75",
    "tax_rate": "0.20",
    "tax_amount": "24.95",
    "amount_incl_tax": "149.70",
    "status": "paid",
    "pdf_available": true
  },
  {
    "invoice_id": "INV-2026-0002",
    "order_id": "301",
    "customer_id": "CUST-0001",
    "issued_at": "2026-09-02T09:00:00Z",
    "due_at": "2026-09-02",
    "currency": "EUR",
    "amount_excl_tax": "37.50",
    "tax_rate": "0.20",
    "tax_amount": "7.50",
    "amount_incl_tax": "45.00",
    "status": "paid",
    "pdf_available": true
  },
  {
    "invoice_id": "INV-2026-0003",
    "order_id": "302",
    "customer_id": "CUST-0001",
    "issued_at": "2026-09-21T09:00:00Z",
    "due_at": "2026-09-21",
    "currency": "EUR",
    "amount_excl_tax": "49.17",
    "tax_rate": "0.20",
    "tax_amount": "9.83",
    "amount_incl_tax": "59.00",
    "status": "paid",
    "pdf_available": true
  },
  {
    "invoice_id": "INV-2026-0004",
    "order_id": "303",
    "customer_id": "CUST-0002",
    "issued_at": "2026-09-05T09:00:00Z",
    "due_at": "2026-09-05",
    "currency": "EUR",
    "amount_excl_tax": "240.83",
    "tax_rate": "0.20",
    "tax_amount": "48.17",
    "amount_incl_tax": "289.00",
    "status": "paid",
    "pdf_available": true
  },
  {
    "invoice_id": "INV-2026-0005",
    "order_id": "304",
    "customer_id": "CUST-0002",
    "issued_at": "2026-09-14T09:00:00Z",
    "due_at": "2026-09-14",
    "currency": "EUR",
    "amount_excl_tax": "115.00",
    "tax_rate": "0.20",
    "tax_amount": "23.00",
    "amount_incl_tax": "138.00",
    "status": "paid",
    "pdf_available": true
  },
  {
    "invoice_id": "INV-2026-0006",
    "order_id": "305",
    "customer_id": "CUST-0002",
    "issued_at": "2026-09-09T09:00:00Z",
    "due_at": "2026-09-09",
    "currency": "EUR",
    "amount_excl_tax": "290.83",
    "tax_rate": "0.20",
    "tax_amount": "58.17",
    "amount_incl_tax": "349.00",
    "status": "refunded",
    "pdf_available": true
  },
  {
    "invoice_id": "INV-2026-0007",
    "order_id": "306",
    "customer_id": "CUST-0003",
    "issued_at": "2026-09-01T09:00:00Z",
    "due_at": "2026-09-01",
    "currency": "EUR",
    "amount_excl_tax": "182.50",
    "tax_rate": "0.20",
    "tax_amount": "36.50",
    "amount_incl_tax": "219.00",
    "status": "paid",
    "pdf_available": true
  },
  {
    "invoice_id": "INV-2026-0008",
    "order_id": "307",
    "customer_id": "CUST-0003",
    "issued_at": "2026-09-10T09:00:00Z",
    "due_at": "2026-09-10",
    "currency": "EUR",
    "amount_excl_tax": "66.58",
    "tax_rate": "0.20",
    "tax_amount": "13.32",
    "amount_incl_tax": "79.90",
    "status": "paid",
    "pdf_available": true
  },
  {
    "invoice_id": "INV-2026-0009",
    "order_id": "308",
    "customer_id": "CUST-0003",
    "issued_at": "2026-09-19T09:00:00Z",
    "due_at": "2026-09-30",
    "currency": "EUR",
    "amount_excl_tax": "157.50",
    "tax_rate": "0.20",
    "tax_amount": "31.50",
    "amount_incl_tax": "189.00",
    "status": "issued",
    "pdf_available": true
  },
  {
    "invoice_id": "INV-2026-0010",
    "order_id": "309",
    "customer_id": "CUST-0004",
    "issued_at": "2026-09-03T09:00:00Z",
    "due_at": "2026-09-03",
    "currency": "EUR",
    "amount_excl_tax": "74.17",
    "tax_rate": "0.20",
    "tax_amount": "14.83",
    "amount_incl_tax": "89.00",
    "status": "refunded",
    "pdf_available": true
  },
  {
    "invoice_id": "INV-2026-0011",
    "order_id": "310",
    "customer_id": "CUST-0004",
    "issued_at": "2026-08-26T09:00:00Z",
    "due_at": "2026-08-26",
    "currency": "EUR",
    "amount_excl_tax": "165.83",
    "tax_rate": "0.20",
    "tax_amount": "33.17",
    "amount_incl_tax": "199.00",
    "status": "paid",
    "pdf_available": true
  },
  {
    "invoice_id": "INV-2026-0012",
    "order_id": "311",
    "customer_id": "CUST-0004",
    "issued_at": "2026-09-20T09:00:00Z",
    "due_at": "2026-09-20",
    "currency": "EUR",
    "amount_excl_tax": "99.17",
    "tax_rate": "0.20",
    "tax_amount": "19.83",
    "amount_incl_tax": "119.00",
    "status": "paid",
    "pdf_available": true
  },
  {
    "invoice_id": "INV-2026-0013",
    "order_id": "312",
    "customer_id": "CUST-0005",
    "issued_at": "2026-09-04T09:00:00Z",
    "due_at": "2026-09-04",
    "currency": "EUR",
    "amount_excl_tax": "124.17",
    "tax_rate": "0.20",
    "tax_amount": "24.83",
    "amount_incl_tax": "149.00",
    "status": "paid",
    "pdf_available": true
  },
  {
    "invoice_id": "INV-2026-0014",
    "order_id": "313",
    "customer_id": "CUST-0005",
    "issued_at": "2026-09-08T09:00:00Z",
    "due_at": "2026-09-08",
    "currency": "EUR",
    "amount_excl_tax": "48.08",
    "tax_rate": "0.20",
    "tax_amount": "9.62",
    "amount_incl_tax": "57.70",
    "status": "partially_refunded",
    "pdf_available": true
  },
  {
    "invoice_id": "INV-2026-0016",
    "order_id": "315",
    "customer_id": "CUST-0006",
    "issued_at": "2026-09-06T09:00:00Z",
    "due_at": "2026-09-06",
    "currency": "EUR",
    "amount_excl_tax": "74.17",
    "tax_rate": "0.20",
    "tax_amount": "14.83",
    "amount_incl_tax": "89.00",
    "status": "paid",
    "pdf_available": true
  },
  {
    "invoice_id": "INV-2026-0017",
    "order_id": "316",
    "customer_id": "CUST-0006",
    "issued_at": "2026-09-18T09:00:00Z",
    "due_at": "2026-09-18",
    "currency": "EUR",
    "amount_excl_tax": "132.50",
    "tax_rate": "0.20",
    "tax_amount": "26.50",
    "amount_incl_tax": "159.00",
    "status": "paid",
    "pdf_available": true
  },
  {
    "invoice_id": "INV-2026-0018",
    "order_id": "317",
    "customer_id": "CUST-0006",
    "issued_at": "2026-09-16T09:00:00Z",
    "due_at": "2026-09-16",
    "currency": "EUR",
    "amount_excl_tax": "24.83",
    "tax_rate": "0.20",
    "tax_amount": "4.97",
    "amount_incl_tax": "29.80",
    "status": "paid",
    "pdf_available": true
  },
  {
    "invoice_id": "INV-2026-0019",
    "order_id": "318",
    "customer_id": "CUST-0002",
    "issued_at": "2026-09-22T09:00:00Z",
    "due_at": "2026-09-22",
    "currency": "EUR",
    "amount_excl_tax": "90.83",
    "tax_rate": "0.20",
    "tax_amount": "18.17",
    "amount_incl_tax": "109.00",
    "status": "paid",
    "pdf_available": true
  },
  {
    "invoice_id": "INV-2026-0020",
    "order_id": "319",
    "customer_id": "CUST-0001",
    "issued_at": "2026-08-29T09:00:00Z",
    "due_at": "2026-08-29",
    "currency": "EUR",
    "amount_excl_tax": "24.92",
    "tax_rate": "0.20",
    "tax_amount": "4.98",
    "amount_incl_tax": "29.90",
    "status": "paid",
    "pdf_available": true
  }
]
